{"ledger_id":"PPR-LEDGER-EXAMPLE-001","run_id":"PPR-RUN-EXAMPLE-001","baseline_id":"PPR-BL-EXAMPLE-001","open_finding_ids":[],"accepted_correction_ids":["COR-EXAMPLE-001"],"rejected_correction_ids":[],"reproof_pending_ids":[],"resolved_finding_ids":["PPR-FND-EXAMPLE-001"],"high_critical_count":0,"source_unavailable_count":0,"upstream_blocker_count":0,"release_recommendation":"ready","owner_groups":["production","volume editor"],"created_at":"2026-08-14T00:00:00Z","supersedes":null}
